ID,File Name,Copyright,License List,Authorship,Description,Description Alternative,Story ID,Chapter ID,Character ID,Seqnum,Limited View,URI DaSCH,Authorship Resource,Multimedia Folder,Time Stamp,File Size
I_001,IMG_1book0.jpg,Public Domain,Public Domain,John Tenniel,King and Queen of Hearts sitting on their throne in court,,ST_001,SCH_001,"CH_017, CH_006, CH_002, CH_035, CH_037",1,no,"https://iiif.rdu-08.dasch.swiss:443/0854/09bjeoll0B7-7N2E7SyicMB.jpx/full/562,800/0/default.jpg","Noémi Villars-Amberg, Daniela Subotic",image,,0.2
I_002,IMG_1book1.jpg,Public Domain,Public Domain,John Tenniel,White Rabbit looking at his watch,,ST_001,SCH_002,CH_002,2,no,"https://iiif.rdu-08.dasch.swiss/0854/5n3odOtpZvy-l88zTITXasW.jpx/full/473,724/0/default.jpg","Noémi Villars-Amberg, Daniela Subotic",image,,0.1
I_003,IMG_1book2.jpg,Public Domain,Public Domain,John Tenniel,Alice finding a little door,,ST_001,SCH_002,CH_001,3,no,"https://iiif.rdu-08.dasch.swiss:443/0854/3G6seftrpZT-DPBfnGBVulI.jpx/full/563,579/0/default.jpg","Noémi Villars-Amberg, Daniela Subotic",image,,0.1
I_004,IMG_1book3.jpg,Public Domain,Public Domain,John Tenniel,"Alice holding the ""Drink Me"" bottle",,ST_001,SCH_002,CH_001,4,no,"https://iiif.rdu-08.dasch.swiss:443/0854/5vTb5Lyp8qW-RRh7Q1ljKUQ.jpx/full/489,696/0/default.jpg","Noémi Villars-Amberg, Daniela Subotic",image,,0.1
I_005,IMG_1book4.jpg,Public Domain,Public Domain,John Tenniel,Alice growing taller,,ST_001,SCH_003,CH_001,5,no,"https://iiif.rdu-08.dasch.swiss:443/0854/0Fj9QbAQisd-igcE71wKj4K.jpx/full/559,1256/0/default.jpg","Noémi Villars-Amberg, Daniela Subotic",image,,0.2
I_006,IMG_1book5.jpg,Public Domain,Public Domain,John Tenniel,White Rabbit skurrying away from Alice,,ST_001,SCH_003,"CH_002, CH_001",6,no,"https://iiif.rdu-08.dasch.swiss:443/0854/3smOiqDQ9DN-sup6KNZyA2V.jpx/full/863,1015/0/default.jpg","Noémi Villars-Amberg, Daniela Subotic",image,,0.3
I_007,IMG_1book6.jpg,Public Domain,Public Domain,John Tenniel,Alice swimming in the Pool of tears,,ST_001,SCH_003,CH_001,7,no,"https://iiif.rdu-08.dasch.swiss:443/0854/0pzUqRgVt0Y-L5tFvUUNlUi.jpx/full/602,494/0/default.jpg","Noémi Villars-Amberg, Daniela Subotic",image,,0.1
I_008,IMG_1book7.jpg,Public Domain,Public Domain,John Tenniel,Alice and the Mouse swimming in the Pool of tears,,ST_001,SCH_003,"CH_001, CH_014",8,no,"https://iiif.rdu-08.dasch.swiss:443/0854/1eEWop1EHTS-kOI3Wwa09Qq.jpx/full/864,574/0/default.jpg","Noémi Villars-Amberg, Daniela Subotic",image,,0.2
I_010,IMG_1book8.jpg,Public Domain,Public Domain,John Tenniel,Mouse telling its tale to Alice and creatures,,ST_001,SCH_004,"CH_014, CH_001, CH_015",9,no,"https://iiif.rdu-08.dasch.swiss:443/0854/1RYuDHP1557-2hazsP3NR7M.jpx/full/853,657/0/default.jpg","Noémi Villars-Amberg, Daniela Subotic",image,,0.2
I_009,IMG_1book9.jpg,Public Domain,Public Domain,John Tenniel,Alice accepting a thimble from Dodo,,ST_001,SCH_004,"CH_001, CH_015",10,no,"https://iiif.rdu-08.dasch.swiss:443/0854/0rJGrIFZqlz-B4VYqLtkesr.jpx/full/793,906/0/default.jpg","Noémi Villars-Amberg, Daniela Subotic",image,,0.3
I_011,IMG_1book10.jpg,Public Domain,Public Domain,John Tenniel,Alice outgrowing White Rabbit's house,,ST_001,SCH_005,CH_001,11,no,"https://iiif.rdu-08.dasch.swiss:443/0854/5F4SRuS5Uqg-LMrPqBzfpu0.jpx/full/850,603/0/default.jpg","Noémi Villars-Amberg, Daniela Subotic",image,,0.3
I_012,IMG_1book11.jpg,Public Domain,Public Domain,John Tenniel,Alice's hand reaching for White Rabbit,,ST_001,SCH_005,"CH_001, CH_002",12,no,"https://iiif.rdu-08.dasch.swiss:443/0854/3KI29IdAOKc-c3Se0M19M0K.jpx/full/496,729/0/default.jpg","Noémi Villars-Amberg, Daniela Subotic",image,,0.1
I_013,IMG_1book12.jpg,Public Domain,Public Domain,John Tenniel,Bill the lizzard rocketting out of the chimney,,ST_001,SCH_005,CH_027,13,no,"https://iiif.rdu-08.dasch.swiss:443/0854/4Xuhkpoh6vZ-ImaCJgCvBcP.jpx/full/457,1228/0/default.jpg","Noémi Villars-Amberg, Daniela Subotic",image,,0.2
I_014,IMG_1book13.jpg,Public Domain,Public Domain,John Tenniel,The puppy looking at Alice,,ST_001,SCH_005,"CH_028, CH_001",14,no,"https://iiif.rdu-08.dasch.swiss:443/0854/0c7M59VEvKx-JNKFTf1qsJ8.jpx/full/859,1024/0/default.jpg","Noémi Villars-Amberg, Daniela Subotic",image,,0.3
I_015,IMG_1book14.jpg,Public Domain,Public Domain,John Tenniel,Caterpillar questionning Alice,,ST_001,SCH_006,"CH_003, CH_001",15,no,"https://iiif.rdu-08.dasch.swiss:443/0854/1tWu7OgJ0aF-advmZieukrF.jpx/full/669,895/0/default.jpg","Noémi Villars-Amberg, Daniela Subotic",image,,0.2
I_016,IMG_1book15.jpg,Public Domain,Public Domain,John Tenniel,Father William standing on his head,,ST_001,SCH_006,CH_038,16,no,"https://iiif.rdu-08.dasch.swiss:443/0854/0dBLw6TfIAT-HWqZyqqz3Qd.jpx/full/857,648/0/default.jpg","Noémi Villars-Amberg, Daniela Subotic",image,,0.2
I_017,IMG_1book16.jpg,Public Domain,Public Domain,John Tenniel,Father William turning a back-sommersault,,ST_001,SCH_006,CH_038,17,no,"https://iiif.rdu-08.dasch.swiss:443/0854/2X5pV7NIVnZ-Om3WW08rBgB.jpx/full/851,646/0/default.jpg","Noémi Villars-Amberg, Daniela Subotic",image,,0.3
I_018,IMG_1book17.jpg,Public Domain,Public Domain,John Tenniel,Father William sitting at a table,,ST_001,SCH_006,CH_038,18,no,"https://iiif.rdu-08.dasch.swiss:443/0854/5qk7DTyNBnW-iNGRTfmyEBr.jpx/full/850,648/0/default.jpg","Noémi Villars-Amberg, Daniela Subotic",image,,0.2
I_019,IMG_1book18.jpg,Public Domain,Public Domain,John Tenniel,Father William balancing an eel,,ST_001,SCH_006,CH_038,19,no,"https://iiif.rdu-08.dasch.swiss:443/0854/4eUiO3JLwne-p5swdDWoF5U.jpx/full/855,647/0/default.jpg","Noémi Villars-Amberg, Daniela Subotic",image,,0.2
I_020,IMG_1book19.jpg,Public Domain,Public Domain,John Tenniel,Frog-Footman and Fish-Footman holding an invitation,,ST_001,SCH_007,CH_030,20,no,"https://iiif.rdu-08.dasch.swiss:443/0854/3zu9GoOXuWu-Kf9QmVPS5d8.jpx/full/714,878/0/default.jpg","Noémi Villars-Amberg, Daniela Subotic",image,,0.3
I_021,IMG_1book20.jpg,Public Domain,Public Domain,John Tenniel,Dutchess nursing the baby,,ST_001,SCH_007,"CH_008, CH_032, CH_001, CH_033, CH_005",21,no,"https://iiif.rdu-08.dasch.swiss:443/0854/7m6YMI26U46-dmIJdPM4rns.jpx/full/854,711/0/default.jpg","Noémi Villars-Amberg, Daniela Subotic",image,,0.3
I_022,IMG_1book21.jpg,Public Domain,Public Domain,John Tenniel,Alice holding the pig baby,,ST_001,SCH_007,"CH_001, CH_032",22,no,"https://iiif.rdu-08.dasch.swiss:443/0854/7R70eezrjYH-Kj6DqU883vG.jpx/full/487,729/0/default.jpg","Noémi Villars-Amberg, Daniela Subotic",image,,0.1
I_023,IMG_1book22.jpg,Public Domain,Public Domain,John Tenniel,Cheshire Cat grinning at Alice,,ST_001,SCH_007,"CH_005, CH_001",23,no,"https://iiif.rdu-08.dasch.swiss:443/0854/0imp6owKpZo-mSR5NiponF8.jpx/full/863,1251/0/default.jpg","Noémi Villars-Amberg, Daniela Subotic",image,,0.3
I_024,IMG_1book23.jpg,Public Domain,Public Domain,John Tenniel,Cheshire Cat disappearing,,ST_001,SCH_007,CH_005,24,no,"https://iiif.rdu-08.dasch.swiss:443/0854/5sESN9wsGRg-kQfkzTuxFed.jpx/full/846,548/0/default.jpg","Noémi Villars-Amberg, Daniela Subotic",image,,0.2
I_025,IMG_1book24.jpg,Public Domain,Public Domain,John Tenniel,Alice sitting at a mad tea-party,,ST_001,SCH_008,"CH_001, CH_018, CH_004, CH_007",25,no,"https://iiif.rdu-08.dasch.swiss:443/0854/7c1FP62D4lR-uplQYcj8wPn.jpx/full/862,658/0/default.jpg","Noémi Villars-Amberg, Daniela Subotic",image,,0.2
I_026,IMG_1book25.jpg,Public Domain,Public Domain,John Tenniel,Hatter singing,,ST_001,SCH_008,"CH_004, CH_018",26,no,"https://iiif.rdu-08.dasch.swiss:443/0854/6GyjS99Mr2Z-VFzceyhsOIu.jpx/full/472,539/0/default.jpg","Noémi Villars-Amberg, Daniela Subotic",image,,0.1
I_027,IMG_1book26.jpg,Public Domain,Public Domain,John Tenniel,Dormouse being put in a teapot,,ST_001,SCH_008,"CH_018, CH_004, CH_007",27,no,"https://iiif.rdu-08.dasch.swiss:443/0854/4GfW8QKV0Ln-BG4HSjFww5A.jpx/full/680,596/0/default.jpg","Noémi Villars-Amberg, Daniela Subotic",image,,0.1
I_028,IMG_1book27.jpg,Public Domain,Public Domain,John Tenniel,Card-gardeners painting roses,,ST_001,SCH_009,CH_035,28,no,"https://iiif.rdu-08.dasch.swiss:443/0854/6s9ugUGS4zz-dnoLMeyytq9.jpx/full/541,755/0/default.jpg","Noémi Villars-Amberg, Daniela Subotic",image,,0.1
I_029,IMG_1book28.jpg,Public Domain,Public Domain,John Tenniel,Queen of Hearts pointing at Alice,,ST_001,SCH_009,"CH_006, CH_001, CH_017",29,no,"https://iiif.rdu-08.dasch.swiss:443/0854/6JcuTiVX1pp-LjbJsHeHrFU.jpx/full/858,1019/0/default.jpg","Noémi Villars-Amberg, Daniela Subotic",image,,0.4
I_030,IMG_1book29.jpg,Public Domain,Public Domain,John Tenniel,Alice holding her Flamingo,,ST_001,SCH_009,"CH_001, CH_036",30,no,"https://iiif.rdu-08.dasch.swiss:443/0854/7CoeMyaDN58-5vCKRGEKm5j.jpx/full/473,689/0/default.jpg","Noémi Villars-Amberg, Daniela Subotic",image,,0.1
I_031,IMG_1book30.jpg,Public Domain,Public Domain,John Tenniel,Executioners and crowd collecting round Cheshire Cat,,ST_001,SCH_009,"CH_005, CH_006, CH_017, CH_002",31,no,"https://iiif.rdu-08.dasch.swiss:443/0854/4MdlmPTONaj-Zod0iPTaOvn.jpx/full/714,919/0/default.jpg","Noémi Villars-Amberg, Daniela Subotic",image,,0.3
I_032,IMG_1book31.jpg,Public Domain,Public Domain,John Tenniel,Alice and Duchess walking,,ST_001,SCH_010,"CH_001, CH_008, CH_036",32,no,"https://iiif.rdu-08.dasch.swiss:443/0854/05qAWprY9IP-rI7HY043Sdj.jpx/full/577,859/0/default.jpg","Noémi Villars-Amberg, Daniela Subotic",image,,0.2
I_033,IMG_1book32.jpg,Public Domain,Public Domain,John Tenniel,Gryphon sleeping,,ST_001,SCH_010,CH_010,33,no,"https://iiif.rdu-08.dasch.swiss:443/0854/2aYc3yqAUBO-i4Mbj5kLao1.jpx/full/846,591/0/default.jpg","Noémi Villars-Amberg, Daniela Subotic",image,,0.2
I_034,IMG_1book33.jpg,Public Domain,Public Domain,John Tenniel,Mock Turtle telling his story to Gryphon and Alice,,ST_001,SCH_010,"CH_009, CH_001, CH_010",34,no,"https://iiif.rdu-08.dasch.swiss:443/0854/3kbOH2D1iQP-jdxX12q8Ojb.jpx/full/849,1018/0/default.jpg","Noémi Villars-Amberg, Daniela Subotic",image,,0.3
I_035,IMG_1book34.jpg,Public Domain,Public Domain,John Tenniel,Mock Turtle and Gryphon dancing round Alice,,ST_001,SCH_010,"CH_009, CH_001, CH_010",35,no,"https://iiif.rdu-08.dasch.swiss:443/0854/01U0IHDDIPG-hoo6gScFhdU.jpx/full/709,849/0/default.jpg","Noémi Villars-Amberg, Daniela Subotic",image,,0.2
I_036,IMG_1book35.jpg,Public Domain,Public Domain,John Tenniel,Lobster turning out his toes ,,ST_001,SCH_011,CH_039,36,no,"https://iiif.rdu-08.dasch.swiss:443/0854/3bonc5QCxLI-PctkPxp8JFw.jpx/full/500,869/0/default.jpg","Noémi Villars-Amberg, Daniela Subotic",image,,0.2
I_037,IMG_1book36.jpg,Public Domain,Public Domain,John Tenniel,White Rabbit as herald blowing a trumpet,,ST_001,SCH_012,CH_002,37,no,"https://iiif.rdu-08.dasch.swiss/0854/68wzca4arPJ-x57imXRKvVF.jpx/full/520,760/0/default.jpg","Noémi Villars-Amberg, Daniela Subotic",image,,0.1
I_038,IMG_1book37.jpg,Public Domain,Public Domain,John Tenniel,Hatter shaking off his shoes,,ST_001,SCH_012,CH_004,38,no,"https://iiif.rdu-08.dasch.swiss:443/0854/2J624xaXkZ5-Ai88xkXtmn5.jpx/full/482,678/0/default.jpg","Noémi Villars-Amberg, Daniela Subotic",image,,0.1
I_039,IMG_1book38.jpg,Public Domain,Public Domain,John Tenniel,Hatter running,,ST_001,SCH_012,CH_004,39,no,"https://iiif.rdu-08.dasch.swiss:443/0854/5LumZ4WsK8f-8hJw0yYSbB9.jpx/full/679,554/0/default.jpg","Noémi Villars-Amberg, Daniela Subotic",image,,0.1
I_040,IMG_1book39.jpg,Public Domain,Public Domain,John Tenniel,Alice tipping over the jury-box,,ST_001,SCH_013,"CH_001, CH_037",40,no,"https://iiif.rdu-08.dasch.swiss:443/0854/77BV0GsdyNM-6XIlFNnoTAp.jpx/full/840,1020/0/default.jpg","Noémi Villars-Amberg, Daniela Subotic",image,,0.3
I_041,IMG_1book40.jpg,Public Domain,Public Domain,John Tenniel,King of Hearts pointing to the tarts in court,,ST_001,SCH_013,"CH_017, CH_037",41,no,"https://iiif.rdu-08.dasch.swiss:443/0854/4d999JqAt3m-Yxzbd9NFVM4.jpx/full/816,1075/0/default.jpg","Noémi Villars-Amberg, Daniela Subotic",image,,0.3
I_042,IMG_1book41.jpg,Public Domain,Public Domain,John Tenniel,Cards flying down upon Alice,,ST_001,SCH_013,CH_001,42,no,"https://iiif.rdu-08.dasch.swiss:443/0854/2MhXG5mSS74-wiw46ZDf5Gf.jpx/full/836,1120/0/default.jpg","Noémi Villars-Amberg, Daniela Subotic",image,,0.3
I_043,IMG_2book0.jpg,Public Domain,Public Domain,John Tenniel,White knight riding his horse,,ST_002,SCH_015,"CH_013, CH_001",43,no,"https://iiif.rdu-08.dasch.swiss/0854/3JlqNbDve2u-TAknAb0cbkp.jpx/full/686,1024/0/default.jpg","Noémi Villars-Amberg, Daniela Subotic",image,2008-08-11T21:33:38-00:00,0.4
I_044,IMG_2book1.jpg,Public Domain,Public Domain,John Tenniel,Black kitten playing,,ST_002,SCH_017,CH_040,44,no,"https://iiif.rdu-08.dasch.swiss:443/0854/4XeF5QaaSoI-Cwgk7glSlUe.jpx/full/1024,652/0/default.jpg","Noémi Villars-Amberg, Daniela Subotic",image,2008-08-11T21:35:42-00:00,0.2
I_045,IMG_2book2.jpg,Public Domain,Public Domain,John Tenniel,Alice winding worsted in an arm-chair,,ST_002,SCH_017,"CH_001, CH_040",45,no,"https://iiif.rdu-08.dasch.swiss:443/0854/4WOm1BdhZ3r-0l9PrJWJU8C.jpx/full/880,1024/0/default.jpg","Noémi Villars-Amberg, Daniela Subotic",image,2008-08-11T21:38:55-00:00,0.4
I_046,IMG_2book3.jpg,Public Domain,Public Domain,John Tenniel,Alice going through the looking-glass,,ST_002,SCH_017,CH_001,46,no,"https://iiif.rdu-08.dasch.swiss:443/0854/0IsMLvOx84Q-1ZvBWsAqCfS.jpx/full/807,1024/0/default.jpg","Noémi Villars-Amberg, Daniela Subotic",image,2008-08-11T21:39:35-00:00,0.3
I_047,IMG_2book4.jpg,Public Domain,Public Domain,John Tenniel,Alice coming through the looking-glass,,ST_002,SCH_017,CH_001,47,no,"https://iiif.rdu-08.dasch.swiss:443/0854/7jsF4SFSaPU-O8OpyBSsbDr.jpx/full/825,1024/0/default.jpg","Noémi Villars-Amberg, Daniela Subotic",image,2008-08-11T21:41:23-00:00,0.3
I_048,IMG_2book5.jpg,Public Domain,Public Domain,John Tenniel,Chessmen walking,,ST_002,SCH_017,CH_041,48,no,"https://iiif.rdu-08.dasch.swiss:443/0854/5ttJtoSoQv9-CUOL2iNzrPl.jpx/full/1024,802/0/default.jpg","Noémi Villars-Amberg, Daniela Subotic",image,2008-08-11T21:42:30-00:00,0.4
I_049,IMG_2book6.jpg,Public Domain,Public Domain,John Tenniel,Alice picking up White King,,ST_002,SCH_017,"CH_001, CH_042",49,no,"https://iiif.rdu-08.dasch.swiss:443/0854/6a9hRdYe39R-E21JhCLBYnN.jpx/full/1024,963/0/default.jpg","Noémi Villars-Amberg, Daniela Subotic",image,2008-08-11T21:43:21-00:00,0.3
I_050,IMG_2book7.jpg,Public Domain,Public Domain,John Tenniel,The White Knight sliding down a poker,,ST_002,SCH_017,CH_013,50,no,"https://iiif.rdu-08.dasch.swiss:443/0854/7IJFYuIdQXO-vLZZgcVeJ6O.jpx/full/761,907/0/default.jpg","Noémi Villars-Amberg, Daniela Subotic",image,2008-08-11T21:45:07-00:00,0.2
I_051,IMG_2book8.jpg,Public Domain,Public Domain,John Tenniel,Jabberwork,,ST_002,SCH_017,CH_026,51,no,"https://iiif.rdu-08.dasch.swiss:443/0854/5XI4CmldszL-eDJqGTERwqj.jpx/full/690,1024/0/default.jpg","Noémi Villars-Amberg, Daniela Subotic",image,2008-08-11T21:46:13-00:00,0.4
I_052,IMG_2book9.jpg,Public Domain,Public Domain,John Tenniel,Tiger-Lily and Alice talking,,ST_002,SCH_018,"CH_043, CH_001",52,no,"https://iiif.rdu-08.dasch.swiss:443/0854/1U11tJ8uukc-6WgmTq8vlav.jpx/full/856,1024/0/default.jpg","Noémi Villars-Amberg, Daniela Subotic",image,2008-08-11T21:46:57-00:00,0.3
I_053,IMG_2book10.jpg,Public Domain,Public Domain,John Tenniel,Alice and Red Queen talking,,ST_002,SCH_018,"CH_001, CH_011",53,no,"https://iiif.rdu-08.dasch.swiss:443/0854/4T7Sic3asPK-YIGZ1bbfc53.jpx/full/852,1024/0/default.jpg","Noémi Villars-Amberg, Daniela Subotic",image,2008-08-11T21:48:10-00:00,0.3
I_054,IMG_2book11.jpg,Public Domain,Public Domain,John Tenniel,Chessboard-like country,,ST_002,SCH_018,,54,no,"https://iiif.rdu-08.dasch.swiss:443/0854/4lAQnqa1oiz-sW2hmRS2iTW.jpx/full/1024,691/0/default.jpg","Noémi Villars-Amberg, Daniela Subotic",image,2008-08-11T21:48:53-00:00,0.3
I_055,IMG_2book12.jpg,Public Domain,Public Domain,John Tenniel,Alice and Red Queen running,,ST_002,SCH_018,"CH_001, CH_011",55,no,"https://iiif.rdu-08.dasch.swiss:443/0854/55BnxCASugO-mJDPyr1YcNq.jpx/full/1024,662/0/default.jpg","Noémi Villars-Amberg, Daniela Subotic",image,2008-08-11T22:41:14-00:00,0.2
I_056,IMG_2book13.jpg,Public Domain,Public Domain,John Tenniel,Alice sittin in a train carriage,,ST_002,SCH_019,CH_001,56,no,"https://iiif.rdu-08.dasch.swiss:443/0854/1WsynkBDVjm-XJCQPzLOWlS.jpx/full/1024,815/0/default.jpg","Noémi Villars-Amberg, Daniela Subotic",image,2008-08-11T21:49:20-00:00,0.4
I_057,IMG_2book14.jpg,Public Domain,Public Domain,John Tenniel,Rocking-horse-fly,,ST_002,SCH_019,,57,no,"https://iiif.rdu-08.dasch.swiss:443/0854/3RGiGhMUwld-cB0XFDeoY3M.jpx/full/1024,673/0/default.jpg","Noémi Villars-Amberg, Daniela Subotic",image,2008-08-11T21:49:50-00:00,0.2
I_058,IMG_2book15.jpg,Public Domain,Public Domain,John Tenniel,Snap-dragon-fly,,ST_002,SCH_019,,58,no,"https://iiif.rdu-08.dasch.swiss:443/0854/4MJH5QBf6X1-HI60hWcYcXR.jpx/full/1024,686/0/default.jpg","Noémi Villars-Amberg, Daniela Subotic",image,2008-08-11T21:50:17-00:00,0.2
I_059,IMG_2book16.jpg,Public Domain,Public Domain,John Tenniel,Bread-and-butter-fly,,ST_002,SCH_019,,59,no,"https://iiif.rdu-08.dasch.swiss:443/0854/5Wr0zCmCpRc-dnxbHUGBPGl.jpx/full/1024,707/0/default.jpg","Noémi Villars-Amberg, Daniela Subotic",image,2008-08-11T21:51:03-00:00,0.2
I_060,IMG_2book17.jpg,Public Domain,Public Domain,John Tenniel,Alice clasping her arms round Fawn,,ST_002,SCH_019,CH_001,60,no,"https://iiif.rdu-08.dasch.swiss:443/0854/3ifEP8xYQF3-kJzcrVHFh4g.jpx/full/788,1024/0/default.jpg","Noémi Villars-Amberg, Daniela Subotic",image,2008-08-11T21:52:26-00:00,0.3
I_061,IMG_2book18.jpg,Public Domain,Public Domain,John Tenniel,Alice calling on Tweedledum and Tweeldee,,ST_002,SCH_020,"CH_001, CH_044",61,no,"https://iiif.rdu-08.dasch.swiss:443/0854/3ZLSjE1V8A7-aqJfsfJNR3b.jpx/full/1024,805/0/default.jpg","Noémi Villars-Amberg, Daniela Subotic",image,2008-08-11T21:53:08-00:00,0.3
I_062,IMG_2book19.jpg,Public Domain,Public Domain,John Tenniel,Walrus and Carpenter walking,,ST_002,SCH_020,"CH_045, CH_046",62,no,"https://iiif.rdu-08.dasch.swiss:443/0854/7KPtlxrpQNj-5bmdCJF2f7q.jpx/full/1024,645/0/default.jpg","Noémi Villars-Amberg, Daniela Subotic",image,2008-08-11T21:51:36-00:00,0.2
I_063,IMG_2book20.jpg,Public Domain,Public Domain,John Tenniel,Walrus and Carpenter resting,,ST_002,SCH_020,"CH_045, CH_046",63,no,"https://iiif.rdu-08.dasch.swiss:443/0854/7lgtdXtIz3e-P0buBvAwoXt.jpx/full/1024,667/0/default.jpg","Noémi Villars-Amberg, Daniela Subotic",image,2008-08-11T21:54:37-00:00,0.2
I_064,IMG_2book21.jpg,Public Domain,Public Domain,John Tenniel,Walrus and Carpenter eating,,ST_002,SCH_020,"CH_045, CH_046",64,no,"https://iiif.rdu-08.dasch.swiss:443/0854/7hoDhWG8DpV-KfD3Po9cbsr.jpx/full/1024,635/0/default.jpg","Noémi Villars-Amberg, Daniela Subotic",image,2008-08-11T21:55:28-00:00,0.2
I_065,IMG_2book22.jpg,Public Domain,Public Domain,John Tenniel,Red King snoring,,ST_002,SCH_020,CH_047,65,no,"https://iiif.rdu-08.dasch.swiss:443/0854/2tzBhmH29mt-OONn4VqYjpk.jpx/full/1024,682/0/default.jpg","Noémi Villars-Amberg, Daniela Subotic",image,2008-08-11T21:55:55-00:00,0.2
I_066,IMG_2book23.jpg,Public Domain,Public Domain,John Tenniel,Tweedledum crying in a fury,,ST_002,SCH_020,"CH_044, CH_001",66,no,"https://iiif.rdu-08.dasch.swiss:443/0854/2v5jxevCGCi-bl7NQq1XJCt.jpx/full/1024,718/0/default.jpg","Noémi Villars-Amberg, Daniela Subotic",image,2008-08-11T21:56:27-00:00,0.3
I_067,IMG_2book24.jpg,Public Domain,Public Domain,John Tenniel,Tweedledum and Tweedledee,,ST_002,SCH_020,"CH_044, CH_001",67,no,"https://iiif.rdu-08.dasch.swiss:443/0854/2gHyUg0B6Yk-wlJdlt5HNNV.jpx/full/1024,757/0/default.jpg","Noémi Villars-Amberg, Daniela Subotic",image,2008-08-11T21:57:05-00:00,0.3
I_068,IMG_2book25.jpg,Public Domain,Public Domain,John Tenniel,Alice adressing White Queen,,ST_002,SCH_021,"CH_001, CH_049",68,no,"https://iiif.rdu-08.dasch.swiss:443/0854/33x1L73Msy3-1pMUJviTEhA.jpx/full/753,1024/0/default.jpg","Noémi Villars-Amberg, Daniela Subotic",image,2008-08-11T21:57:32-00:00,0.3
I_069,IMG_2book26.jpg,Public Domain,Public Domain,John Tenniel,Hatta sitting in prison,,ST_002,SCH_021,"CH_004, ",69,no,"https://iiif.rdu-08.dasch.swiss:443/0854/7lr1ZUbLtGH-bYdt6xIcvJr.jpx/full/733,1024/0/default.jpg","Noémi Villars-Amberg, Daniela Subotic",image,2008-08-11T21:58:28-00:00,0.3
I_070,IMG_2book27.jpg,Public Domain,Public Domain,John Tenniel,Alice leaning on counter in Sheep's shop,,ST_002,SCH_021,"CH_001, CH_052",70,no,"https://iiif.rdu-08.dasch.swiss:443/0854/7G0bO7jZ8WH-KzzPbYlosd2.jpx/full/840,1024/0/default.jpg","Noémi Villars-Amberg, Daniela Subotic",image,2008-08-11T21:58:56-00:00,0.4
I_071,IMG_2book28.jpg,Public Domain,Public Domain,John Tenniel,Alice rowing a boat,,ST_002,SCH_021,"CH_001, CH_052",71,no,"https://iiif.rdu-08.dasch.swiss:443/0854/6gSFmQqq6uD-vN4ZWmLj9H9.jpx/full/849,1024/0/default.jpg","Noémi Villars-Amberg, Daniela Subotic",image,2008-08-11T21:59:24-00:00,0.4
I_072,IMG_2book29.jpg,Public Domain,Public Domain,John Tenniel,Humpty Dumpty offering Alice his hand,,ST_002,SCH_022,"CH_012, CH_001",72,no,"https://iiif.rdu-08.dasch.swiss:443/0854/713hfQkOStq-5XXXnprxzZ6.jpx/full/889,1024/0/default.jpg","Noémi Villars-Amberg, Daniela Subotic",image,2008-08-11T22:00:02-00:00,0.2
I_073,IMG_2book30.jpg,Public Domain,Public Domain,John Tenniel,Jabberwocky creatures,,ST_002,SCH_022,,73,no,"https://iiif.rdu-08.dasch.swiss:443/0854/0XZa6RXOxbN-z5rGGLl9VH7.jpx/full/835,1024/0/default.jpg","Noémi Villars-Amberg, Daniela Subotic",image,2008-08-11T22:00:37-00:00,0.3
I_074,IMG_2book31.jpg,Public Domain,Public Domain,John Tenniel,Humpty Dumpty sending a message,,ST_002,SCH_022,CH_012,74,no,"https://iiif.rdu-08.dasch.swiss:443/0854/5hYkCQoDCgz-dYCPo8cmJd9.jpx/full/651,1024/0/default.jpg","Noémi Villars-Amberg, Daniela Subotic",image,2008-08-11T22:11:51-00:00,0.2
I_075,IMG_2book32.jpg,Public Domain,Public Domain,John Tenniel,White King soldiers and horses stumbling,,ST_002,SCH_023,,75,no,"https://iiif.rdu-08.dasch.swiss:443/0854/6C9idpNxho8-xtXIAFb6HUY.jpx/full/846,1024/0/default.jpg","Noémi Villars-Amberg, Daniela Subotic",image,2008-08-11T22:11:19-00:00,0.4
I_076,IMG_2book33.jpg,Public Domain,Public Domain,John Tenniel,Haigha handing a ham sandwich to the White King,,ST_002,SCH_023,"CH_007, CH_042, CH_001",76,no,"https://iiif.rdu-08.dasch.swiss:443/0854/4JC09zXsEJr-RlmI7zov2ww.jpx/full/1024,835/0/default.jpg","Noémi Villars-Amberg, Daniela Subotic",image,2008-08-11T22:12:56-00:00,0.3
I_077,IMG_2book34.jpg,Public Domain,Public Domain,John Tenniel,Hatta drinking tea,,ST_002,SCH_023,"CH_004, CH_007, CH_042, CH_001, CH_054, CH_053",77,no,"https://iiif.rdu-08.dasch.swiss:443/0854/3waISaS2Lmq-yfjS2XEY8u0.jpx/full/1024,790/0/default.jpg","Noémi Villars-Amberg, Daniela Subotic",image,2008-08-11T22:13:33-00:00,0.3
I_078,IMG_2book35.jpg,Public Domain,Public Domain,John Tenniel,Alice holding a plum cake,,ST_002,SCH_023,"CH_001, CH_054, CH_053",78,no,"https://iiif.rdu-08.dasch.swiss:443/0854/7g0lapw9RM1-rrjU84JFJMz.jpx/full/1024,761/0/default.jpg","Noémi Villars-Amberg, Daniela Subotic",image,2008-08-11T22:14:19-00:00,0.3
I_079,IMG_2book36.jpg,Public Domain,Public Domain,John Tenniel,Alice putting her hands over her ears,,ST_002,SCH_023,CH_001,79,no,"https://iiif.rdu-08.dasch.swiss:443/0854/1oo61Azcvo2-9nZEsle5Gaf.jpx/full/731,1024/0/default.jpg","Noémi Villars-Amberg, Daniela Subotic",image,2008-08-11T22:15:29-00:00,0.3
I_080,IMG_2book37.jpg,Public Domain,Public Domain,John Tenniel,Red Knight and White Knight fighting,,ST_002,SCH_024,"CH_048, CH_013, CH_001",80,no,"https://iiif.rdu-08.dasch.swiss:443/0854/1utfNtQnBNa-mIk8BYfZrlr.jpx/full/977,1024/0/default.jpg","Noémi Villars-Amberg, Daniela Subotic",image,2008-08-11T22:16:20-00:00,0.4
I_081,IMG_2book38.jpg,Public Domain,Public Domain,John Tenniel,White Knight falling off his horse,,ST_002,SCH_024,"CH_013, CH_001",81,no,"https://iiif.rdu-08.dasch.swiss:443/0854/1Me05KANaA0-GK0BgOo4Adk.jpx/full/935,1024/0/default.jpg","Noémi Villars-Amberg, Daniela Subotic",image,2008-08-11T22:17:06-00:00,0.3
I_082,IMG_2book39.jpg,Public Domain,Public Domain,John Tenniel,Alice dragging White Knight out off a ditch,,ST_002,SCH_024,"CH_001, CH_013",82,no,"https://iiif.rdu-08.dasch.swiss:443/0854/30ZSayoqOpY-5H4WAU9gj70.jpx/full/1024,698/0/default.jpg","Noémi Villars-Amberg, Daniela Subotic",image,2008-08-11T22:17:34-00:00,0.3
I_083,IMG_2book40.jpg,Public Domain,Public Domain,John Tenniel,White Knight shaking an aged man,,ST_002,SCH_024,CH_013,83,no,"https://iiif.rdu-08.dasch.swiss:443/0854/2AEguPuu3zj-SZdYXr0G3RD.jpx/full/1024,860/0/default.jpg","Noémi Villars-Amberg, Daniela Subotic",image,2008-08-11T22:18:07-00:00,0.3
I_084,IMG_2book41.jpg,Public Domain,Public Domain,John Tenniel,Alice lifting off a golden crown,,ST_002,SCH_024,CH_001,84,no,"https://iiif.rdu-08.dasch.swiss:443/0854/0KbUq2nYqKX-ZZnPhSlPk2P.jpx/full/688,1024/0/default.jpg","Noémi Villars-Amberg, Daniela Subotic",image,2008-08-11T22:19:02-00:00,0.2
I_085,IMG_2book42.jpg,Public Domain,Public Domain,John Tenniel,Red Queen and White Queen sitting with Alice,,ST_002,SCH_025,"CH_011, CH_049, CH_001",85,no,"https://iiif.rdu-08.dasch.swiss:443/0854/4AqIBSN7DtM-X6GsO7nZ7Hn.jpx/full/1024,690/0/default.jpg","Noémi Villars-Amberg, Daniela Subotic",image,2008-08-11T22:19:35-00:00,0.2
I_086,IMG_2book43.jpg,Public Domain,Public Domain,John Tenniel,Red Queen and White Queen sleeping on Alice,,ST_002,SCH_025,"CH_011, CH_049, CH_001",86,no,"https://iiif.rdu-08.dasch.swiss:443/0854/0Ll6U7QTtBV-8pgyTEFhIYm.jpx/full/1024,691/0/default.jpg","Noémi Villars-Amberg, Daniela Subotic",image,2008-08-11T22:20:01-00:00,0.2
I_087,IMG_2book44.jpg,Public Domain,Public Domain,John Tenniel,Alice and Frog standing before a door,,ST_002,SCH_025,"CH_001, CH_030",87,no,"https://iiif.rdu-08.dasch.swiss:443/0854/6AzWW8Ik3iv-gZROWBdCNAl.jpx/full/809,1024/0/default.jpg","Noémi Villars-Amberg, Daniela Subotic",image,2008-08-11T22:20:33-00:00,0.3
