ID,File Name,Copyright,License List,Authorship,Description,Description Alternative,Story ID,Chapter ID,Character ID,Seqnum,Limited View,URI DaSCH,Authorship Resource,Multimedia Folder,Time Stamp,File Size
I_088,IMG_2book45.jpg,Public Domain,Public Domain,John Tenniel,Mutton making a little bow,,ST_002,SCH_025,,88,no,"https://iiif.rdu-08.dasch.swiss:443/0854/4Vr0N3s9YLI-HXiLWR5G4Il.jpx/full/752,1024/0/default.jpg","Noémi Villars-Amberg, Daniela Subotic",image,2008-08-11T22:21:11-00:00,0.2
I_089,IMG_2book46.jpg,Public Domain,Public Domain,John Tenniel,Alice pulling a table cloth,,ST_002,SCH_025,CH_001,89,no,"https://iiif.rdu-08.dasch.swiss:443/0854/60CJq5SkRcO-3SgKypU9RaL.jpx/full/702,1024/0/default.jpg","Noémi Villars-Amberg, Daniela Subotic",image,2008-08-11T22:22:20-00:00,0.3
I_090,IMG_2book47.jpg,Public Domain,Public Domain,John Tenniel,Alice shaking Red Queen,,ST_002,SCH_026,"CH_001, CH_011",90,no,"https://iiif.rdu-08.dasch.swiss:443/0854/2yXgwS1vTLv-qAlgh7hk527.jpx/full/657,1024/0/default.jpg","Noémi Villars-Amberg, Daniela Subotic",image,2008-08-11T22:22:53-00:00,0.2
I_091,IMG_2book48.jpg,Public Domain,Public Domain,John Tenniel,Alice shaking Kitty,,ST_002,SCH_027,"CH_001, CH_040",91,no,"https://iiif.rdu-08.dasch.swiss:443/0854/6zMQ7zlb0VE-68BqVL1QlPT.jpx/full/710,1024/0/default.jpg","Noémi Villars-Amberg, Daniela Subotic",image,2008-08-11T22:23:23-00:00,0.2
I_092,IMG_2book49.jpg,Public Domain,Public Domain,John Tenniel,Alice looking over her shoulder at White Kitten,,ST_002,SCH_028,"CH_001, CH_050",92,no,"https://iiif.rdu-08.dasch.swiss:443/0854/4nHJ3rc65wa-pNeHgK9Yr8q.jpx/full/977,1024/0/default.jpg","Noémi Villars-Amberg, Daniela Subotic",image,2008-08-11T22:23:55-00:00,0.3
I_093,IMGALT_Alice_1.jpg,AI-Generated,AI-Generated,AI-Generated,,DaSCHland Alice navigating the RabbIT hole,ST_001,SCH_002,CH_001,93,yes,,"Noémi Villars-Amberg, Daniela Subotic",image_alternative,,2.1
I_094,IMGALT_Alice_2.jpg,AI-Generated,AI-Generated,AI-Generated,,DaSCHland Alice navigating the RabbIT hole,ST_001,SCH_002,CH_002,94,yes,,"Noémi Villars-Amberg, Daniela Subotic",image_alternative,,0.4
I_095,IMGALT_Archival_Madcap.png,AI-Generated,AI-Generated,AI-Generated,,Archival Madcap drinking tea,ST_001,SCH_008,CH_004,95,yes,,"Noémi Villars-Amberg, Daniela Subotic",image_alternative,,0.7
I_096,IMGALT_Cyberpillar_1.jpg,AI-Generated,AI-Generated,AI-Generated,,Cyberpillar on his mushroom,ST_001,SCH_006,CH_003,96,yes,,"Noémi Villars-Amberg, Daniela Subotic",image_alternative,,0.4
I_097,IMGALT_DaSCHland.jpg,AI-Generated,AI-Generated,AI-Generated,,Alice arriving at DaSCHland entrance,ST_001,SCH_001,CH_001,97,yes,,"Noémi Villars-Amberg, Daniela Subotic",image_alternative,,2.3
I_098,IMGALT_Data_Queen.jpg,AI-Generated,AI-Generated,AI-Generated,,Data Queen glowing red,ST_001,SCH_009,CH_006,98,yes,,"Noémi Villars-Amberg, Daniela Subotic",image_alternative,,0.3
I_099,IMGALT_Mockup_Data.jpg,AI-Generated,AI-Generated,AI-Generated,,Mock-up Data being obsolete,ST_001,SCH_010,CH_009,99,yes,,"Noémi Villars-Amberg, Daniela Subotic",image_alternative,,0.4
I_100,IMGALT_Quantum_Cat.jpg,AI-Generated,AI-Generated,AI-Generated,,Quantum Cat appearing,ST_001,SCH_007,CH_005,100,yes,,"Noémi Villars-Amberg, Daniela Subotic",image_alternative,,0.4
I_101,IMGALT_RabbIT.jpg,AI-Generated,AI-Generated,AI-Generated,,RabbIT looking at 3D Map of DaSCHland,ST_001,SCH_002,CH_002,101,yes,,"Noémi Villars-Amberg, Daniela Subotic",image_alternative,,0.4
I_102,IMGALT_Real-Time_Processor.jpg,AI-Generated,AI-Generated,AI-Generated,,Real-Time Processor being in the now,ST_001,SCH_008,CH_018,102,yes,,"Noémi Villars-Amberg, Daniela Subotic",image_alternative,,0.3
I_103,IMGALT_System_Protector.jpg,AI-Generated,AI-Generated,AI-Generated,,System Protector looking over data,ST_001,SCH_010,CH_010,103,yes,,"Noémi Villars-Amberg, Daniela Subotic",image_alternative,,0.5
